{
  "$schema": "https://json-schema.org/draft/2020-12/schema",
  "title": "Rehab Agent session record",
  "description": "One folder per session (docs/hardware.md protocol step 7). No direct identifiers: person_ref is pseudonymous.",
  "type": "object",
  "required": ["session_id", "person_ref", "started_at", "twin_tier", "hardware", "streams", "calibration", "sync", "accuracy_layers"],
  "properties": {
    "session_id": {"type": "string"},
    "person_ref": {"type": "string", "description": "Pseudonymous reference only. Never a name or medical record number."},
    "started_at": {"type": "string", "format": "date-time"},
    "synthetic": {"type": "boolean", "description": "True for example/test data. Must be false for real sessions."},
    "twin_tier": {"enum": ["A", "B", "C"], "description": "docs/accuracy.md tiers. Tier travels with the data."},
    "hardware": {
      "type": "array",
      "items": {
        "type": "object",
        "required": ["device_id", "type"],
        "properties": {
          "device_id": {"type": "string"},
          "type": {"enum": ["rgb-camera", "iphone-lidar", "realsense-d455", "imu-suit", "emg", "other"]},
          "serial_or_name": {"type": "string"},
          "firmware": {"type": "string"}
        }
      }
    },
    "streams": {
      "type": "array",
      "items": {
        "type": "object",
        "required": ["device_id", "modality", "file"],
        "properties": {
          "device_id": {"type": "string"},
          "modality": {"enum": ["rgb", "depth", "pointcloud", "imu", "emg", "pose2d", "pose3d"]},
          "file": {"type": "string"},
          "fps": {"type": "number"},
          "resolution": {"type": "string"}
        }
      }
    },
    "calibration": {
      "type": "object",
      "required": ["intrinsics_source", "extrinsics_file", "reprojection_error_px"],
      "properties": {
        "intrinsics_source": {"type": "string"},
        "extrinsics_file": {"type": "string"},
        "reprojection_error_px": {"type": "number"}
      }
    },
    "sync": {
      "type": "object",
      "required": ["method", "max_offset_ms_after_correction"],
      "properties": {
        "method": {"const": "labstreaminglayer"},
        "proof_event": {"type": "string", "description": "e.g. LED flash / hand clap at session start"},
        "max_offset_ms_after_correction": {"type": "number", "description": "Must be < 5 for kinematics use (docs/hardware.md)"}
      }
    },
    "accuracy_layers": {
      "type": "object",
      "description": "Per docs/accuracy.md: status of each layer for this person/session.",
      "additionalProperties": {
        "type": "object",
        "required": ["status"],
        "properties": {
          "status": {"enum": ["personalised", "generic", "unvalidated"]},
          "error": {"type": "string", "description": "Measured error with units, e.g. 'joint-centre <= 4 mm vs MRI'"}
        }
      }
    },
    "breathing": {
      "type": "object",
      "description": "(audit, breathing programme) Per docs/research-breathing-tracking.md. Diaphragm motion is INFERRED from surface/compartment signals unless directly measured by ultrasound - the label must travel with the data. Asynchrony values are screening flags for clinician review (D-03), never diagnoses.",
      "properties": {
        "signal_source": {"enum": ["dual-belt-rip", "depth-camera", "oep-lite-markerless", "spirometry-calibration", "ultrasound", "none"]},
        "respiratory_rate_bpm": {"type": "number"},
        "ie_ratio": {"type": "number", "description": "Inspiratory:expiratory time ratio"},
        "compartment_volume_share_pct": {
          "type": "object",
          "description": "Relative contribution to tidal volume by compartment (sums to ~100)",
          "properties": {
            "pulmonary_ribcage": {"type": "number"},
            "abdominal_ribcage": {"type": "number"},
            "abdomen": {"type": "number"}
          }
        },
        "thoracoabdominal_phase_angle_deg": {"type": "number", "description": "Rib-cage vs abdomen phase angle; 0 = synchronous, 180 = paradoxical"},
        "end_expiratory_volume_drift_ml": {"type": "number", "description": "Drift of end-expiratory level over the recording (air-trapping / relaxation marker); only if calibrated"},
        "diaphragm_status": {"enum": ["inferred", "ultrasound-measured"], "description": "inferred = rendered from surface signal; ultrasound-measured = excursion/thickening directly observed"},
        "screening_flags": {"type": "array", "items": {"type": "string"}, "description": "e.g. 'thoracoabdominal asynchrony - clinician review'. Screening only."}
      }
    }
  }
}
